id,link,upvotes,posting_datetime,title
1j8qj13,https://www.reddit.com/r/ProgressionFantasy/comments/1j8qj13/the_king_of_losers_a_meme_journey/,1,2025-03-11T13:18:20+00:00,The King of Losers - A meme journey
1j8oihq,https://www.reddit.com/r/ProgressionFantasy/comments/1j8oihq/my_seventh_victor_of_tucson_book_earthshaker_is/,1,2025-03-11T11:27:00+00:00,"My seventh Victor of Tucson book, Earthshaker, is live on KU and Audible! Check it out!~"
1j8l9v6,https://www.reddit.com/r/ProgressionFantasy/comments/1j8l9v6/god_slayer/,1,2025-03-11T07:26:55+00:00,God Slayer !!!
1j8kwg8,https://www.reddit.com/r/ProgressionFantasy/comments/1j8kwg8/an_atypical_system_apocalypse_a_litrpg/,1,2025-03-11T06:58:59+00:00,"An atypical system apocalypse - A litRPG, Progression fantasy Epic."
1j8kc5d,https://www.reddit.com/r/ProgressionFantasy/comments/1j8kc5d/welcome_to_the_dark_ages/,1,2025-03-11T06:17:03+00:00,Welcome to the Dark Ages
1j7yx27,https://www.reddit.com/r/ProgressionFantasy/comments/1j7yx27/monday_mango_media_release_ajaxs_ascension_the/,1,2025-03-10T13:43:54+00:00,Monday Mango Media Release - Ajax's Ascension: The Capital
1j7x71l,https://www.reddit.com/r/ProgressionFantasy/comments/1j7x71l/i_am_writing_a_web_novel_titled_ain_khael_and_its/,1,2025-03-10T12:14:25+00:00,"I am writing a web novel titled ""Ain' Khael"" and it's available on Tapas"
1j7vuks,https://www.reddit.com/r/ProgressionFantasy/comments/1j7vuks/merchant_of_yliaster_is_out_on_royalroad/,1,2025-03-10T10:49:53+00:00,Merchant Of Yliaster is out on RoyalRoad!
1j7uk9i,https://www.reddit.com/r/ProgressionFantasy/comments/1j7uk9i/ready_to_be_cooked_please_help/,1,2025-03-10T09:15:23+00:00,Ready to be cooked PLEASE HELP
1j7kwkn,https://www.reddit.com/r/ProgressionFantasy/comments/1j7kwkn/i_wrote_a_novel/,3,2025-03-09T23:30:51+00:00,I wrote a novel
1j7kufo,https://www.reddit.com/r/ProgressionFantasy/comments/1j7kufo/celeste_raven_from_herald_of_humanity_she_is_the/,3,2025-03-09T23:28:00+00:00,"Celeste Raven from Herald of Humanity. She is the first to join the team. She is a mix of Olenna Tyrell and Han Solo. Yes she is a goth, gunslinger, demi-human, cowgirl, rogue, support escort. Link in first post."
1j7e3zh,https://www.reddit.com/r/ProgressionFantasy/comments/1j7e3zh/realms_of_the_veiled_paths_a_new_isekai/,5,2025-03-09T18:30:35+00:00,"[REALMS OF THE VEILED PATHS] - a new isekai progression fantasy with compelling characters, magical beasts, politics, empire wars, the odd dungeon and fighting. A lot of fighting. 6 chapters up (17k words), and a min of 3 chapters being posted a week (though I'm hoping to post 6 a week initially)"
1j7b968,https://www.reddit.com/r/ProgressionFantasy/comments/1j7b968/no_strings_attached_a_soulslike_fantasy/,1,2025-03-09T16:26:24+00:00,No Strings Attached! A Soulslike Fantasy!
1j76ry7,https://www.reddit.com/r/ProgressionFantasy/comments/1j76ry7/to_you_my_brother_a_revenge_isekai_litrpg_is_now/,1,2025-03-09T12:39:09+00:00,"[To You, My Brother], a revenge isekai LitRPG, is now out! Just got my first 10 followers and my first rating :D New chapters out every weekday"
1j73e0o,https://www.reddit.com/r/ProgressionFantasy/comments/1j73e0o/26k_words_uploaded/,1,2025-03-09T08:38:28+00:00,26k words uploaded
1j72g8d,https://www.reddit.com/r/ProgressionFantasy/comments/1j72g8d/conqueror_of_the_lost_world_is_out_now_on_rr/,1,2025-03-09T07:29:32+00:00,"Conqueror of the Lost World is out now on RR! Currently at Chapter 35, with (52,286 words) released."
1j6uzj1,https://www.reddit.com/r/ProgressionFantasy/comments/1j6uzj1/a_pyromaniacs_ascent_out_now_on_rr_currently_26/,1,2025-03-09T00:14:34+00:00,"A Pyromaniac's Ascent out now on RR! Currently 26 chapters(50,000 words) released!"
1j6ud89,https://www.reddit.com/r/ProgressionFantasy/comments/1j6ud89/beta_readers_wanted_for_my_litrpg_story/,1,2025-03-08T23:43:44+00:00,Beta Readers Wanted for My LitRPG Story
1j64xgh,https://www.reddit.com/r/ProgressionFantasy/comments/1j64xgh/hunt_monsters_assimilate_their_parts_and_be_sure/,1,2025-03-08T00:38:31+00:00,"Hunt monsters, assimilate their parts, and be sure to always carry a vial of water : Heartworm reached 100k words."
1j63pqy,https://www.reddit.com/r/ProgressionFantasy/comments/1j63pqy/gilgamesh_hit_1_million_views/,1,2025-03-07T23:39:26+00:00,Gilgamesh hit 1 million views
1j62u9x,https://www.reddit.com/r/ProgressionFantasy/comments/1j62u9x/see_these_bones_on_sale_and_on_kickstarter_the/,1,2025-03-07T22:58:41+00:00,See These Bones on sale and on Kickstarter; The Queen of the Road up for preorder
1j5yyl6,https://www.reddit.com/r/ProgressionFantasy/comments/1j5yyl6/my_light_novel_in_progress/,1,2025-03-07T20:11:30+00:00,My light novel in progress
1j5m89i,https://www.reddit.com/r/ProgressionFantasy/comments/1j5m89i/mana_and_might_celebrating_women_in_litrpg_space/,1,2025-03-07T12:21:31+00:00,Mana and Might: Celebrating Women in LitRPG Space (aka Female MC stories on sale now)
1j5l45h,https://www.reddit.com/r/ProgressionFantasy/comments/1j5l45h/from_circuits_to_swords_qi_code/,1,2025-03-07T11:10:59+00:00,From Circuits to Swords: Qi &amp; Code
1j4zagx,https://www.reddit.com/r/ProgressionFantasy/comments/1j4zagx/if_you_like_weaktostrong_protagonists_heroes_who/,1,2025-03-06T16:23:41+00:00,"If you like weak-to-strong protagonists, heroes who are underleveled but overpowered, fast-paced level-ups, rare classes, and gods worth defying then you’ll love Hatch’s new immersive isekai fantasy LitRPG adventure!"
1j4qg2r,https://www.reddit.com/r/ProgressionFantasy/comments/1j4qg2r/the_dark_lord_left_for_cigarettes/,1,2025-03-06T07:50:27+00:00,The Dark Lord Left For Cigarettes!
1j4ajhe,https://www.reddit.com/r/ProgressionFantasy/comments/1j4ajhe/just_reaches_3_rs_on_royal_road/,1,2025-03-05T18:48:20+00:00,Just reaches 3 RS on Royal Road!
1j48brq,https://www.reddit.com/r/ProgressionFantasy/comments/1j48brq/crimson_hydra_series_on_sale_gene_harvest_ebook/,5,2025-03-05T17:20:44+00:00,Crimson Hydra series on sale! (Gene Harvest ebook and both audiobooks!)
1j480ly,https://www.reddit.com/r/ProgressionFantasy/comments/1j480ly/youre_going_to_form_the_ultimate_beast_by/,6,2025-03-05T17:08:16+00:00,You're going to form the ultimate beast by attaching parts of different creatures to your body: which ones do you choose?
1j406ud,https://www.reddit.com/r/ProgressionFantasy/comments/1j406ud/what_if_the_ai_meant_to_save_you_became_your/,1,2025-03-05T10:34:30+00:00,"""What if the AI meant to save you became your curse? Legacy.exe—a dark cyber-thriller where an AI built by a dead wife uncovers the truth behind a global manhunt. Read now:https://www.royalroad.com/fiction/107888/legacyexe"
1j3zazb,https://www.reddit.com/r/ProgressionFantasy/comments/1j3zazb/honest_feedback/,24,2025-03-05T09:29:44+00:00,Honest Feedback
1j3vwhe,https://www.reddit.com/r/ProgressionFantasy/comments/1j3vwhe/looking_for_feedback_in_my_xianxia_novel/,1,2025-03-05T05:26:32+00:00,Looking for feedback in my xianxia novel
1j3sykd,https://www.reddit.com/r/ProgressionFantasy/comments/1j3sykd/fearshaper_cultivation_of_fear_statslite_artwork/,1,2025-03-05T02:43:32+00:00,FEARSHAPER [Cultivation of Fear] [Stats-lite] Artwork by @ni_ni_er_
1j3pf1e,https://www.reddit.com/r/ProgressionFantasy/comments/1j3pf1e/the_man_the_myth_the_ultimate_level_1_legend/,1,2025-03-04T23:51:50+00:00,"The Man, The Myth, The Ultimate Level 1 Legend!"
1j3mfli,https://www.reddit.com/r/ProgressionFantasy/comments/1j3mfli/i_just_released_my_first_light_novel_chapter/,1,2025-03-04T21:42:22+00:00,I just released my first light novel chapter..
1j3m5ac,https://www.reddit.com/r/ProgressionFantasy/comments/1j3m5ac/edge_of_the_woods_now_available_in_paperback/,6,2025-03-04T21:30:23+00:00,Edge of the Woods - Now Available in Paperback!
1j3cxb5,https://www.reddit.com/r/ProgressionFantasy/comments/1j3cxb5/the_mage_errant_illustrated_omnibus_kickstarter/,63,2025-03-04T15:11:36+00:00,The Mage Errant Illustrated Omnibus Kickstarter is live- and the first three ebooks are free on Amazon!
1j3bav8,https://www.reddit.com/r/ProgressionFantasy/comments/1j3bav8/mage_tank_book_1_has_been_summoned_forth_onto/,1,2025-03-04T13:55:46+00:00,"Mage Tank, Book 1 has been summoned forth onto Kindle and Audible!"
1j3ax4f,https://www.reddit.com/r/ProgressionFantasy/comments/1j3ax4f/despairs_demise_the_final_book_in_odyssey_of_the/,1,2025-03-04T13:36:54+00:00,"Despair's Demise, the final book in Odyssey of the Ethereal, out now."
1j3ah13,https://www.reddit.com/r/ProgressionFantasy/comments/1j3ah13/starbreaker_volume_1_is_now_available/,34,2025-03-04T13:13:30+00:00,Starbreaker: Volume 1 is now available!
1j2hnzq,https://www.reddit.com/r/ProgressionFantasy/comments/1j2hnzq/tired_of_spellswords_sick_of_blood_mages_great/,46,2025-03-03T12:34:50+00:00,Tired of spellswords? Sick of blood mages? Great!
1j243ov,https://www.reddit.com/r/ProgressionFantasy/comments/1j243ov/a_cultivation_novel_where_power_comes_at_a/,4,2025-03-02T23:00:37+00:00,A Cultivation Novel Where Power Comes at a Horrifying Price
1j1q2ol,https://www.reddit.com/r/ProgressionFantasy/comments/1j1q2ol/calling_all_fans_of_cultivation_martial_arts_and/,1,2025-03-02T12:46:28+00:00,"Calling All Fans of Cultivation, Martial Arts, and Magic – Join Us at r/TheHeavenlyDao!"
1j1o2pf,https://www.reddit.com/r/ProgressionFantasy/comments/1j1o2pf/are_you_tired_of_overpower_main_characters_and_1/,1,2025-03-02T10:36:33+00:00,Are you tired of overpower main characters and 1 dimensional side characters and generic villains? Then I suggest you my novel: Burn the Beast.
1j1nhco,https://www.reddit.com/r/ProgressionFantasy/comments/1j1nhco/burden_of_ascension/,1,2025-03-02T09:55:11+00:00,Burden of Ascension
1j1n7eg,https://www.reddit.com/r/ProgressionFantasy/comments/1j1n7eg/epiclitnet_update_diary_activity_and_more/,1,2025-03-02T09:35:03+00:00,"EpicLit.net update: diary, activity and more..."
1j1kp0t,https://www.reddit.com/r/ProgressionFantasy/comments/1j1kp0t/from_comedic_isekai_to_epic_fantasy_does_a/,1,2025-03-02T06:37:12+00:00,From Comedic Isekai to Epic Fantasy – Does a Dramatic Tone Shift Work?
1j19id7,https://www.reddit.com/r/ProgressionFantasy/comments/1j19id7/strength_based_wizard_official_artwork_by/,1,2025-03-01T20:54:07+00:00,STRENGTH BASED WIZARD - Official Artwork by Vladimir Solnyshko [Link &amp; Details in Comments]
1j15dqz,https://www.reddit.com/r/ProgressionFantasy/comments/1j15dqz/dont_combust_comic_launch_and_giveaway/,1,2025-03-01T17:55:30+00:00,Don't Combust Comic Launch and Giveaway!
1j11rul,https://www.reddit.com/r/ProgressionFantasy/comments/1j11rul/i_was_summoned_to_hunt_monsters_but_they_want_to/,1,2025-03-01T15:20:24+00:00,I Was Summoned to Hunt Monsters… But They Want to Hunt ME?!
1j11mwi,https://www.reddit.com/r/ProgressionFantasy/comments/1j11mwi/zealot_reincarnation/,1,2025-03-01T15:14:13+00:00,Zealot Reincarnation
1j11duw,https://www.reddit.com/r/ProgressionFantasy/comments/1j11duw/two_living_gods_rule_america_woodrow_brown/,1,2025-03-01T15:02:56+00:00,"Two living gods rule America. Woodrow Brown prefers his gods dead. The first 20,000 words of The Patchwork God are out today!"
1j103xp,https://www.reddit.com/r/ProgressionFantasy/comments/1j103xp/new_monthly_book_release_announcement_thread/,1,2025-03-01T14:01:43+00:00,New Monthly Book Release Announcement Thread
1j0xkbd,https://www.reddit.com/r/ProgressionFantasy/comments/1j0xkbd/world_of_chaos_a_gamelit_regressor_story_with/,12,2025-03-01T11:35:13+00:00,World of Chaos – A Game-Lit Regressor Story with Deep Progression!
1j0xdh1,https://www.reddit.com/r/ProgressionFantasy/comments/1j0xdh1/first_book_of_my_new_series_is_out_master_of/,1,2025-03-01T11:22:11+00:00,First book of my new series is out! Master of Bones: A necromancer tries to save the world by eating souls...
1j0tbqh,https://www.reddit.com/r/ProgressionFantasy/comments/1j0tbqh/new_book_on_royal_road/,1,2025-03-01T06:36:40+00:00,New book on ROYAL ROAD
1j0ryvw,https://www.reddit.com/r/ProgressionFantasy/comments/1j0ryvw/go_big_to_go_home_3_arcs_completed_and_now_on/,1,2025-03-01T05:10:51+00:00,Go Big To Go Home; 3 Arcs completed and now on Rising Stars!
1j0odhl,https://www.reddit.com/r/ProgressionFantasy/comments/1j0odhl/etherious_the_locus_of_power_is_available_on/,1,2025-03-01T01:51:05+00:00,Etherious: The Locus of Power is available on Amazon and KU
