id,link,upvotes,posting_datetime,title
1joha1x,https://www.reddit.com/r/ProgressionFantasy/comments/1joha1x/patreon_before_finishing_a_book/,1,2025-03-31T23:20:08+00:00,Patreon before finishing a book 🤔
1joh9xn,https://www.reddit.com/r/ProgressionFantasy/comments/1joh9xn/which_novel_cover_is_better_and_why/,1,2025-03-31T23:19:57+00:00,Which Novel Cover is Better and Why
1joh62v,https://www.reddit.com/r/ProgressionFantasy/comments/1joh62v/tell_me_which_novel_cover_is_better_and_why/,1,2025-03-31T23:14:56+00:00,Tell Me Which Novel Cover is Better and Why
1joawka,https://www.reddit.com/r/ProgressionFantasy/comments/1joawka/remember_all_those_posts_searching_for_hidden/,1,2025-03-31T18:52:57+00:00,Remember all those posts searching for hidden gems with under a 1000 followers? Look no further!
1jo6rxo,https://www.reddit.com/r/ProgressionFantasy/comments/1jo6rxo/fantasy_scifi_litrpg_release/,1,2025-03-31T16:05:10+00:00,Fantasy + Sci-Fi LitRPG release!
1jo5rer,https://www.reddit.com/r/ProgressionFantasy/comments/1jo5rer/free_book_promo/,1,2025-03-31T15:22:35+00:00,Free book promo!
1jnwem7,https://www.reddit.com/r/ProgressionFantasy/comments/1jnwem7/the_dark_lord_left_for_cigarettes_is_34_chapters/,1,2025-03-31T05:52:33+00:00,The Dark Lord Left For Cigarettes is 34 chapters in!
1jnebjz,https://www.reddit.com/r/ProgressionFantasy/comments/1jnebjz/businessbuilding_progression_fantasy_in_a/,1,2025-03-30T15:02:18+00:00,Business-building progression fantasy (in a gunpowder-era merchant republic) on Royal Road
1jn8rom,https://www.reddit.com/r/ProgressionFantasy/comments/1jn8rom/my_first_story/,1,2025-03-30T09:25:28+00:00,My first story!
1jmvqhl,https://www.reddit.com/r/ProgressionFantasy/comments/1jmvqhl/level_up_new_litrpg_obtained_trapped_in_a_vr_game/,2,2025-03-29T20:42:13+00:00,[Level Up!] [New LitRPG Obtained; Trapped in a VR game with my grandma!] 500 pages so far and almost daily chapters!
1jmvobn,https://www.reddit.com/r/ProgressionFantasy/comments/1jmvobn/level_up_new_skill_ttvg_trapped_in_a_vr_game_with/,1,2025-03-29T20:39:30+00:00,"[Level up!] [New Skill; TTVG, trapped in a VR game with my grandma close to 500 pages obtained!]"
1jmpbr0,https://www.reddit.com/r/ProgressionFantasy/comments/1jmpbr0/combining_elements_of_progression_fantasy_epic/,1,2025-03-29T15:53:50+00:00,"Combining elements of Progression Fantasy, Epic Fantasy, and Sword and Sorcery Novels, here's the first book of my series, Hedge Knight, titled The Knight from Nothing (Free for today!)"
1jmezo9,https://www.reddit.com/r/ProgressionFantasy/comments/1jmezo9/book_4_in_my_dark_progression_fantasy_series_is/,1,2025-03-29T05:02:06+00:00,Book 4 in my dark progression fantasy series is now out! Path of the Ascendant available on KU
1jmev38,https://www.reddit.com/r/ProgressionFantasy/comments/1jmev38/book_4_in_my_dark_progression_fantasy_series_is/,1,2025-03-29T04:54:06+00:00,Book 4 in my dark progression fantasy series is now out! Path of the Ascendant available on KU
1jmcw0q,https://www.reddit.com/r/ProgressionFantasy/comments/1jmcw0q/i_released_a_new_thing_youngest_son_of_the/,1,2025-03-29T02:56:58+00:00,I released a new thing...  Youngest Son of the Black-Hearted [Amazon]
1jmc604,https://www.reddit.com/r/ProgressionFantasy/comments/1jmc604/when_the_heavens_turned_away_a_xianxia_epic_of/,0,2025-03-29T02:17:28+00:00,"""When the Heavens Turned Away"" - A Xianxia Epic of Lost Gods and Mortal Defiance [RoyalRoad]"
1jmahzp,https://www.reddit.com/r/ProgressionFantasy/comments/1jmahzp/a_project_i_recently_started_for_fun_if_you_like/,1,2025-03-29T00:51:16+00:00,"A project I recently started for fun. If you like Re:Zero and Souls games, perhaps Dark Resurrection: Shadows of Nekrom it's for you."
1jlxfeo,https://www.reddit.com/r/ProgressionFantasy/comments/1jlxfeo/who_are_you/,1,2025-03-28T15:15:34+00:00,Who Are You?
1jlxct4,https://www.reddit.com/r/ProgressionFantasy/comments/1jlxct4/id_like_to_pitch_my_novel_who_are_you/,1,2025-03-28T15:12:23+00:00,I'd like to pitch my novel: Who Are You?
1jlwzy5,https://www.reddit.com/r/ProgressionFantasy/comments/1jlwzy5/i_just_posted_my_first_story/,1,2025-03-28T14:57:11+00:00,I just posted my first story!
1jlwsie,https://www.reddit.com/r/ProgressionFantasy/comments/1jlwsie/i_just_posted_my_first_story/,1,2025-03-28T14:47:59+00:00,I just posted my first story!
1jltjj6,https://www.reddit.com/r/ProgressionFantasy/comments/1jltjj6/my_cultivation_series_nameless_sovereign_just/,1,2025-03-28T12:08:38+00:00,"My cultivation series, Nameless Sovereign, just released book 4 on Amazon!"
1jltjin,https://www.reddit.com/r/ProgressionFantasy/comments/1jltjin/fight_level_survive_book_2_is_coming_out_in_may/,1,2025-03-28T12:08:37+00:00,Fight. Level. Survive. Book 2 is coming out in May! Pre-Order now! Spoilers from book 1
1jlrx1r,https://www.reddit.com/r/ProgressionFantasy/comments/1jlrx1r/im_sharing_my_work_my_immortal_simulation_life/,1,2025-03-28T10:25:52+00:00,"I'm sharing my work ""My Immortal Simulation Life with Cheat Skill""."
1jlc4qr,https://www.reddit.com/r/ProgressionFantasy/comments/1jlc4qr/unholy_chaos/,1,2025-03-27T19:57:17+00:00,Unholy Chaos
1jlb7ff,https://www.reddit.com/r/ProgressionFantasy/comments/1jlb7ff/i_started_my_first_novel_ravenous_flame_last_week/,1,2025-03-27T18:39:53+00:00,"I started my first novel, Ravenous Flame, last week and I would love some feedback!"
1jlb5oe,https://www.reddit.com/r/ProgressionFantasy/comments/1jlb5oe/my_series_an_outcast_in_another_world_got_a_comic/,164,2025-03-27T18:37:51+00:00,My series An Outcast In Another World got a comic adaptation!
1jl9wxu,https://www.reddit.com/r/ProgressionFantasy/comments/1jl9wxu/cosmic_ascension_audiobook_2_now_available_on/,23,2025-03-27T17:46:53+00:00,Cosmic Ascension AudioBook 2 now available on Audible!
1jl3n23,https://www.reddit.com/r/ProgressionFantasy/comments/1jl3n23/audiobook_giveaway_way_of_the_immortals_complete/,1,2025-03-27T13:14:44+00:00,Audiobook Giveaway - Way of the Immortals - Complete Series from Harmon Cooper!
1jl157u,https://www.reddit.com/r/ProgressionFantasy/comments/1jl157u/need_some_fastpaced_zerotohero_witty_mc_action/,1,2025-03-27T10:53:19+00:00,"Need some fast-paced, zero-to-hero, witty MC action? Sol Anchor Book Three is Out on Audible NOW!"
1jkyvl6,https://www.reddit.com/r/ProgressionFantasy/comments/1jkyvl6/new_story_on_royal_road/,1,2025-03-27T08:01:25+00:00,New Story on Royal Road
1jkv1jv,https://www.reddit.com/r/ProgressionFantasy/comments/1jkv1jv/just_launched_my_first_novel_on_royalroad_swan/,1,2025-03-27T03:40:29+00:00,Just launched my first novel on RoyalRoad: Swan Song
1jktv04,https://www.reddit.com/r/ProgressionFantasy/comments/1jktv04/is_this_a_first_chapter_that_would_make_you_want/,1,2025-03-27T02:36:48+00:00,Is this a first chapter that would make you want to read more ? Critique me Seniors [~900 words]
1jkl15u,https://www.reddit.com/r/ProgressionFantasy/comments/1jkl15u/whos_ready_for_arcane_ascension_5/,1,2025-03-26T19:57:04+00:00,Who's ready for Arcane Ascension 5?
1jkku5h,https://www.reddit.com/r/ProgressionFantasy/comments/1jkku5h/whos_ready_for_arcane_ascension_5/,1,2025-03-26T19:49:02+00:00,Who's ready for Arcane Ascension 5?
1jkfiby,https://www.reddit.com/r/ProgressionFantasy/comments/1jkfiby/a_dysfunctional_family_embarks_on_a_litrpg/,1,2025-03-26T16:11:31+00:00,"A dysfunctional family embarks on a LitRPG Adventure…! Honey, I'v Leveled the Kids now on Rising Stars."
1jkaauf,https://www.reddit.com/r/ProgressionFantasy/comments/1jkaauf/the_tales_of_gods_herding/,1,2025-03-26T12:13:45+00:00,The Tales of Gods Herding
1jk61hy,https://www.reddit.com/r/ProgressionFantasy/comments/1jk61hy/what_if_magical_girls_met_mecha_in_an_allout_war/,1,2025-03-26T07:13:00+00:00,What if Magical Girls met Mecha in an all-out war?
1jk4w1h,https://www.reddit.com/r/ProgressionFantasy/comments/1jk4w1h/what_if_magical_girls_met_mecha_in_an_allout_war/,1,2025-03-26T05:48:07+00:00,What if Magical Girls met Mecha in an all-out war?
1jk4vef,https://www.reddit.com/r/ProgressionFantasy/comments/1jk4vef/what_if_magical_girls_met_mecha_in_an_allout_war/,1,2025-03-26T05:46:52+00:00,What if Magical Girls met Mecha in an all-out war?
1jk110s,https://www.reddit.com/r/ProgressionFantasy/comments/1jk110s/better_late_than_never_string_a_superhero_setting/,1,2025-03-26T02:05:32+00:00,Better late than never! String - A Superhero Setting Webserial
1jjlr5h,https://www.reddit.com/r/ProgressionFantasy/comments/1jjlr5h/starting_my_own_dark_progression_fantasy_web/,2,2025-03-25T15:16:07+00:00,Starting My Own  Dark Progression Fantasy Web Novel – Would Love Feedback!
1jjlj2p,https://www.reddit.com/r/ProgressionFantasy/comments/1jjlj2p/the_heavenly_throne_13_is_live_on_amazon_link_in/,5,2025-03-25T15:06:31+00:00,The Heavenly Throne 13 is live on Amazon! Link in reply!
1jjkuu1,https://www.reddit.com/r/ProgressionFantasy/comments/1jjkuu1/just_released_my_first_story_on_royalroad_the_art/,19,2025-03-25T14:37:02+00:00,Just released my first story on royalroad: The Art of Gold Digging.
1jjjopk,https://www.reddit.com/r/ProgressionFantasy/comments/1jjjopk/audiobook_for_mana_mirror_the_second_gate_is_out/,21,2025-03-25T13:44:33+00:00,Audiobook for Mana Mirror: The Second Gate is OUT NOW!
1jjjm44,https://www.reddit.com/r/ProgressionFantasy/comments/1jjjm44/audiobook_for_mana_mirror_the_second_gate_is_out/,1,2025-03-25T13:41:05+00:00,Audiobook for Mana Mirror: The Second Gate is OUT NOW!
1jjj257,https://www.reddit.com/r/ProgressionFantasy/comments/1jjj257/welcome_to_apocalypse_arena_the_legend_of/,25,2025-03-25T13:13:56+00:00,Welcome to Apocalypse Arena! The legend of Godpuncher Nil begins!
1jjhxfm,https://www.reddit.com/r/ProgressionFantasy/comments/1jjhxfm/blood_curse_academia_book_1_launches_today_on_ku/,21,2025-03-25T12:15:13+00:00,Blood Curse Academia Book 1 Launches today on KU and Audible!!
1jjfl42,https://www.reddit.com/r/ProgressionFantasy/comments/1jjfl42/what_if_your_mentor_was_preparing_you_for_war_and/,4,2025-03-25T09:43:33+00:00,What if your mentor was preparing you for war… and you didn’t know it?
1jiy2ql,https://www.reddit.com/r/ProgressionFantasy/comments/1jiy2ql/shamelessly_self_promoting_since_its_new_i_hop_it/,1,2025-03-24T18:34:13+00:00,Shamelessly self promoting. Since it's new i hop it reaches to more people https://www.royalroad.com/fiction/109855/first-bone
1jitt80,https://www.reddit.com/r/ProgressionFantasy/comments/1jitt80/thresholder_teaguewater_out_on_kindle_unlimited/,1,2025-03-24T15:45:49+00:00,Thresholder: Teaguewater out on Kindle Unlimited! Cover by Slothbeing.
1jird1k,https://www.reddit.com/r/ProgressionFantasy/comments/1jird1k/i_did_the_thing_rise_of_the_bone_king_now_live_on/,1,2025-03-24T14:01:51+00:00,I did the thing. Rise of the Bone King now live on Royal Road!
1jiq4h5,https://www.reddit.com/r/ProgressionFantasy/comments/1jiq4h5/hi_id_like_to_sell_you_on_a_progression_fantasy/,1,2025-03-24T13:02:33+00:00,"Hi, I'd like to sell you on a progression fantasy book without any progression"
1jilyan,https://www.reddit.com/r/ProgressionFantasy/comments/1jilyan/the_dark_ladys_guide_to_villainy_is_on_rising/,1,2025-03-24T08:30:26+00:00,The Dark Lady’s Guide to Villainy is on Rising Stars on Royal Road
1jidv0l,https://www.reddit.com/r/ProgressionFantasy/comments/1jidv0l/shattered_beyond_end_brutal_squadbased_scifi/,1,2025-03-24T00:11:28+00:00,"Shattered: Beyond End – Brutal Squad-Based Sci-Fi Fantasy Inspired by CounterSide, CSM &amp; AOT (Feedback Wanted!)"
1jhwxvf,https://www.reddit.com/r/ProgressionFantasy/comments/1jhwxvf/self_promotion_of_my_story/,1,2025-03-23T11:13:18+00:00,Self Promotion of my story
1jhojaw,https://www.reddit.com/r/ProgressionFantasy/comments/1jhojaw/self_promo_of_my_novel_with_a_actual_villain/,1,2025-03-23T01:52:17+00:00,Self Promo of my Novel With a Actual Villain  - Eternal Reverence
1jhh8zb,https://www.reddit.com/r/ProgressionFantasy/comments/1jhh8zb/realms_of_the_veiled_paths_an_isekai_litrpg/,1,2025-03-22T20:01:24+00:00,"Realms of the Veiled Paths - an Isekai, LitRPG, Progession Fantasy. Yes, it does actually have all of those elements! 15 chapters, a total of 40k words posted. I think you'll enjoy it! Come follow me on this journey!"
1jhgjom,https://www.reddit.com/r/ProgressionFantasy/comments/1jhgjom/just_discovered_this_genre_and_now_im_writing_a/,1,2025-03-22T19:30:51+00:00,Just discovered this genre and now I’m writing a webnovel
1jh3j82,https://www.reddit.com/r/ProgressionFantasy/comments/1jh3j82/ascendants_by_jaracoman/,1,2025-03-22T08:01:11+00:00,Ascendants by JaracoMan
1jgz42h,https://www.reddit.com/r/ProgressionFantasy/comments/1jgz42h/5th_day_stats/,1,2025-03-22T03:10:39+00:00,5th Day Stats!!!
1jgvbv9,https://www.reddit.com/r/ProgressionFantasy/comments/1jgvbv9/the_new_world_ln/,1,2025-03-21T23:56:51+00:00,The New World - LN
1jgsv40,https://www.reddit.com/r/ProgressionFantasy/comments/1jgsv40/want_a_new_novel_to_read_read_demons_dark_destiny/,1,2025-03-21T22:03:36+00:00,Want A new novel to read? Read Demons dark Destiny!
1jgn2io,https://www.reddit.com/r/ProgressionFantasy/comments/1jgn2io/defier_of_fate_strong_to_stronger_progression/,1,2025-03-21T17:56:48+00:00,Defier of Fate - Strong to Stronger Progression Fantasy
1jgn0hh,https://www.reddit.com/r/ProgressionFantasy/comments/1jgn0hh/defier_of_fate_strong_to_stronger_progression/,1,2025-03-21T17:54:21+00:00,Defier of Fate - Strong to Stronger Progression Fantasy
1jg5h0d,https://www.reddit.com/r/ProgressionFantasy/comments/1jg5h0d/sculptors_ascension_in_webnovel/,1,2025-03-21T01:32:18+00:00,Sculptor's Ascension in webnovel
1jg318h,https://www.reddit.com/r/ProgressionFantasy/comments/1jg318h/sins_of_the_forefathers_vol_1_chained_awakening/,1,2025-03-20T23:32:47+00:00,Sins of the Forefathers Vol. 1: Chained Awakening is now available in Audiobook! (Link in description)
1jfzeaf,https://www.reddit.com/r/ProgressionFantasy/comments/1jfzeaf/gunsoul_a_postapocalyptic_litrpg_audiobook_now/,1,2025-03-20T20:55:40+00:00,GUNSOUL - A Post-apocalyptic LitRPG - Audiobook Now Available
1jftrf2,https://www.reddit.com/r/ProgressionFantasy/comments/1jftrf2/trials_of_dominion_book_one_of_the_soulweaver/,1,2025-03-20T17:03:42+00:00,Trials of Dominion - Book One of the Soulweaver Series - Is Now Available on eBook and Audio!
1jfteqs,https://www.reddit.com/r/ProgressionFantasy/comments/1jfteqs/what_do_you_mean_terrorizing_the_whole_world_is_a/,1,2025-03-20T16:48:50+00:00,What do you mean terrorizing the whole world is a terrible way to make it a better place? It works!
1jfqvgn,https://www.reddit.com/r/ProgressionFantasy/comments/1jfqvgn/can_any_kind_soul_read_my_2400_word_count/,1,2025-03-20T15:00:04+00:00,Can any kind soul read my 2400 word count prologue. Would love advice and to see how well I did!
1jfovpb,https://www.reddit.com/r/ProgressionFantasy/comments/1jfovpb/throne_hunters_1_audiobook_now_available_for/,1,2025-03-20T13:27:05+00:00,Throne Hunters #1 audiobook now available for pre-order
1jfmrl8,https://www.reddit.com/r/ProgressionFantasy/comments/1jfmrl8/denwen_a_dark_fantasy_progression_novel_with/,1,2025-03-20T11:32:36+00:00,Denwen – A Dark Fantasy Progression Novel with Mythological Depth &amp; Cataclysmic Stakes
1jfe1c0,https://www.reddit.com/r/ProgressionFantasy/comments/1jfe1c0/royalroad_the_streaming_spirit_sculptor_becomes_a/,1,2025-03-20T01:51:17+00:00,[RoyalRoad] The Streaming Spirit Sculptor Becomes a GOD
1jf9l1y,https://www.reddit.com/r/ProgressionFantasy/comments/1jf9l1y/royalroad_the_streaming_spirit_sculptor_becomes_a/,1,2025-03-19T22:21:52+00:00,[RoyalRoad] The Streaming Spirit Sculptor Becomes a GOD
1jf935d,https://www.reddit.com/r/ProgressionFantasy/comments/1jf935d/the_streaming_spirit_sculptor_becomes_a_god/,1,2025-03-19T22:00:33+00:00,The Streaming Spirit Sculptor Becomes a GOD
1jf0i34,https://www.reddit.com/r/ProgressionFantasy/comments/1jf0i34/dark_ascension_isekai_progression_dark_fantasy/,1,2025-03-19T16:04:35+00:00,Dark Ascension (Isekai | Progression | Dark Fantasy) - Preorder now (Releases 5/5/25)
1jegbyk,https://www.reddit.com/r/ProgressionFantasy/comments/1jegbyk/meet_the_two_mcs_the_multiplepersonality_love/,1,2025-03-18T21:22:25+00:00,"Meet the two MCs (+ the multiple-personality love interest) of CyberGene! Upgrade with Cybernetics! Consume Mutations! Evolve beyond Humanity! Volume 1: Blood and Steel finishes on March 21st on RR with 121 chapters and 400k+ words of crime, action, and hope amidst the hopeless! [LitRPG]"
1jeayx4,https://www.reddit.com/r/ProgressionFantasy/comments/1jeayx4/walking_lemon_new_book_for_fun/,2,2025-03-18T17:45:24+00:00,Walking Lemon (new book for fun)
1je4d4b,https://www.reddit.com/r/ProgressionFantasy/comments/1je4d4b/1_lifesteal_available_on_kindle_unlimited_and/,4,2025-03-18T13:00:04+00:00,1% Lifesteal: Available on Kindle Unlimited and Audible!
1je3tfp,https://www.reddit.com/r/ProgressionFantasy/comments/1je3tfp/im_james_hunter_owner_of_shadow_alley_press_and/,39,2025-03-18T12:31:20+00:00,"I'm James Hunter, owner of Shadow Alley Press and Author of Viridian Gate Online, Rogue Dungeon, Vigil Bound and my newest book Discount Dan! Ask me Anything!"
1jdz85l,https://www.reddit.com/r/ProgressionFantasy/comments/1jdz85l/revenge_story_without_regression_or_reincarnation/,1,2025-03-18T07:06:53+00:00,"Revenge story without Regression or Reincarnation, it's dark and incomplete."
1jdo5j3,https://www.reddit.com/r/ProgressionFantasy/comments/1jdo5j3/blind_chaos_tales_beneath_the_dragoneye_moons/,1,2025-03-17T21:19:26+00:00,Blind Chaos - Tales Beneath the Dragoneye Moons - Book 1 Complete!
1jdlgzj,https://www.reddit.com/r/ProgressionFantasy/comments/1jdlgzj/relaunched_xianxia_transmigration_webnovel_the/,1,2025-03-17T19:31:25+00:00,Relaunched Xianxia Transmigration Webnovel- The Emperor Can't Catch A Break(7 Chapters out now!)
1jdizhj,https://www.reddit.com/r/ProgressionFantasy/comments/1jdizhj/mango_media_is_please_to_present_metaworld/,1,2025-03-17T17:53:06+00:00,Mango Media is please to present: Metaworld Chronicles 8!
1jdhfb4,https://www.reddit.com/r/ProgressionFantasy/comments/1jdhfb4/my_book_the_dark_lord_left_for_cigarettes_is_now/,1,2025-03-17T16:51:37+00:00,My book The Dark Lord Left For Cigarettes is now on Rising Stars Main!
1jdcqm5,https://www.reddit.com/r/ProgressionFantasy/comments/1jdcqm5/maid_with_necromancy_nearing_1000_followers/,1,2025-03-17T13:33:35+00:00,Maid with Necromancy nearing 1000 followers.
1jdaxm1,https://www.reddit.com/r/ProgressionFantasy/comments/1jdaxm1/merchant_of_yliaster_a_wishgranter_litrpg_is_out/,1,2025-03-17T12:00:10+00:00,Merchant Of Yliaster - A Wishgranter LitRPG Is Out On Royalroad.
1jdat8c,https://www.reddit.com/r/ProgressionFantasy/comments/1jdat8c/merchant_of_yliaster_a_wishgranter_litrpg_is_out/,1,2025-03-17T11:53:03+00:00,Merchant Of Yliaster - A Wishgranter LitRPG Is Out On Royalroad.
1jdaijr,https://www.reddit.com/r/ProgressionFantasy/comments/1jdaijr/merchant_of_yliaster_a_wishgranter_litrpg_is_out/,3,2025-03-17T11:35:10+00:00,Merchant Of Yliaster - A Wishgranter LitRPG Is Out On Royalroad.
1jd6mn6,https://www.reddit.com/r/ProgressionFantasy/comments/1jd6mn6/new_launch_tick_tock_on_the_clock_litrpg/,1,2025-03-17T06:52:15+00:00,NEW LAUNCH: Tick Tock On The Clock [LITRPG DECKBUILDING with TIME Ticking down]
1jcu7j2,https://www.reddit.com/r/ProgressionFantasy/comments/1jcu7j2/author_here_fantasy_and_horror/,1,2025-03-16T19:58:18+00:00,Author here. Fantasy and Horror.
1jcrwbl,https://www.reddit.com/r/ProgressionFantasy/comments/1jcrwbl/wanna_see_epic_battle_between_mobile_suits_and/,1,2025-03-16T18:20:11+00:00,Wanna see Epic battle between Mobile suits and Mages? Have a look!
1jckuc1,https://www.reddit.com/r/ProgressionFantasy/comments/1jckuc1/i_tried_writing_litrpg_combat_and_just_combat_in/,1,2025-03-16T12:56:27+00:00,I tried writing LitRPG combat (and just combat in general). What do you guys think?
1jcjwbw,https://www.reddit.com/r/ProgressionFantasy/comments/1jcjwbw/i_tried_writing_litrpg_combat_and_just_combat_in/,1,2025-03-16T12:00:16+00:00,I tried writing LitRPG combat (and just combat in general). What do you guys think?
1jcdn2e,https://www.reddit.com/r/ProgressionFantasy/comments/1jcdn2e/1st_page_of_a_comedic_cultivation_novel_let_me/,0,2025-03-16T04:28:36+00:00,1st page of a comedic cultivation novel. Let me know if this is actually funny
1jcdl6r,https://www.reddit.com/r/ProgressionFantasy/comments/1jcdl6r/weak_kobold_wants_to_conquer_on_royal_road/,1,2025-03-16T04:25:17+00:00,Weak Kobold Wants to Conquer: on Royal Road
1jc4pz0,https://www.reddit.com/r/ProgressionFantasy/comments/1jc4pz0/the_chronicles_of_amber/,1,2025-03-15T20:45:15+00:00,The Chronicles of Amber
1jc3jty,https://www.reddit.com/r/ProgressionFantasy/comments/1jc3jty/i_made_the_first_chapter_of_my_web_novel/,1,2025-03-15T19:52:29+00:00,I made the first chapter of my web novel
1jc2zk1,https://www.reddit.com/r/ProgressionFantasy/comments/1jc2zk1/with_his_fathers_sword_an_anti_hero_takes_over/,1,2025-03-15T19:27:10+00:00,With His Father's Sword - an anti hero takes over the world!
1jc0thk,https://www.reddit.com/r/ProgressionFantasy/comments/1jc0thk/paths_of_akashic_3_a_new_home_is_now_available_on/,1,2025-03-15T17:50:50+00:00,Paths of Akashic 3: A New Home is now available on Kindle &amp; KU
1jbxqy1,https://www.reddit.com/r/ProgressionFantasy/comments/1jbxqy1/sky_pride_hit_rising_stars_front_page_in_six_days/,1,2025-03-15T15:35:04+00:00,Sky Pride Hit Rising Stars Front Page in Six Days!
1jbsn04,https://www.reddit.com/r/ProgressionFantasy/comments/1jbsn04/my_book_just_got_to_rising_stars_scifi_genre/,1,2025-03-15T10:59:40+00:00,My book just got to Rising stars!! (Sci-fi genre)
1japkto,https://www.reddit.com/r/ProgressionFantasy/comments/1japkto/a_litrpg_progression_fantasy_epic_ai_cover_by/,0,2025-03-13T23:08:45+00:00,A litRPG Progression Fantasy Epic (AI cover by professional graphics designer @ https://www.royalroad.com/profile/332476)
1jalsz5,https://www.reddit.com/r/ProgressionFantasy/comments/1jalsz5/magical_card_apocalypse_launch_week_bonus_points/,4,2025-03-13T20:25:34+00:00,Magical Card Apocalypse (Launch Week!) - bonus points if you can decipher my chicken scratches
1jadoae,https://www.reddit.com/r/ProgressionFantasy/comments/1jadoae/caine_chronicles_of_amber_sora_see_him_like_this/,2,2025-03-13T14:47:30+00:00,Caine Chronicles of Amber - Sora see him like this
1jaafqe,https://www.reddit.com/r/ProgressionFantasy/comments/1jaafqe/arcanist_in_another_world_an_archmage_isekai/,1,2025-03-13T12:08:03+00:00,Arcanist In Another World - An Archmage Isekai LitRPG Story on Royalroad NOW!
1ja66x8,https://www.reddit.com/r/ProgressionFantasy/comments/1ja66x8/selfpromotion_im_writing_a_martial_arts_novel_and/,1,2025-03-13T07:01:21+00:00,"Self-promotion: I'm writing a martial arts novel, and Chapter 55 is out today!"
1ja5nbs,https://www.reddit.com/r/ProgressionFantasy/comments/1ja5nbs/yo_guys_can_i_get_some_reviews_for_my_novel/,1,2025-03-13T06:20:33+00:00,Yo Guys... Can I get some reviews for my novel ?
1ja214k,https://www.reddit.com/r/ProgressionFantasy/comments/1ja214k/shadow_uprising_shieldwall_academy_book_4_is_out/,1,2025-03-13T02:40:17+00:00,Shadow Uprising: Shieldwall Academy Book 4 is out! 99c Series Sale and Free Audio codes!
1j9s8pt,https://www.reddit.com/r/ProgressionFantasy/comments/1j9s8pt/im_sure_many_have_read_one_of_the_greatest_works/,1,2025-03-12T19:15:39+00:00,I'm sure many have read one of the greatest works - Roger Zelazny - The Chronicles of Amber. Sora gave her vision of one of the characters - Bleys
1j9rqac,https://www.reddit.com/r/ProgressionFantasy/comments/1j9rqac/conquest_of_the_dragon_sovereign_just_passed_21/,1,2025-03-12T18:55:24+00:00,Conquest of the Dragon Sovereign just passed 21 chapters!
1j9rblf,https://www.reddit.com/r/ProgressionFantasy/comments/1j9rblf/emberscale_alchemist_a_slow_burn_progression/,1,2025-03-12T18:39:40+00:00,"Emberscale Alchemist, a slow burn progression litrpg with heavy slice of life elements"
1j9naon,https://www.reddit.com/r/ProgressionFantasy/comments/1j9naon/guildless_knight_progression_fantasy_cover_metyuu/,1,2025-03-12T15:56:21+00:00,Guildless Knight [Progression Fantasy] Cover - Metyuu
1j9m924,https://www.reddit.com/r/ProgressionFantasy/comments/1j9m924/hell_difficulty_tutorial_book_4_is_out/,1,2025-03-12T15:11:26+00:00,Hell Difficulty Tutorial: Book 4 is out!
1j9loh3,https://www.reddit.com/r/ProgressionFantasy/comments/1j9loh3/die_respawn_repeat_2_is_out_on_ku_time_repeats/,42,2025-03-12T14:47:03+00:00,"DIE. RESPAWN. REPEAT. 2 is out on KU! Time repeats, but nothing stays the same, for every repetition leaves its wounds in the world."
1j98g43,https://www.reddit.com/r/ProgressionFantasy/comments/1j98g43/the_whole_of_archetype_volume_1_will_soon_be_live/,1,2025-03-12T02:10:30+00:00,"The whole of Archetype volume 1 will soon be live on Hogfell’s channel. It’s a slowburn superhero progression, moral MC, not overpowered, naive MC."
1j95vpd,https://www.reddit.com/r/ProgressionFantasy/comments/1j95vpd/new_writer_hereis_my_fantasyreincarnation_magic/,1,2025-03-12T00:10:07+00:00,New Writer Here—Is My Fantasy/Reincarnation Magic System Interesting? Looking for Feedback on My Royal Road Story!
1j8zb66,https://www.reddit.com/r/ProgressionFantasy/comments/1j8zb66/savage_soul_a_wild_tarzanlike_protagonist_learns/,5,2025-03-11T19:30:07+00:00,Savage Soul - A wild Tarzan-like protagonist learns cultivation
1j8xmxc,https://www.reddit.com/r/ProgressionFantasy/comments/1j8xmxc/discount_dan_is_live_on_amazon_ku_and_audible/,1,2025-03-11T18:21:33+00:00,"Discount Dan is Live on Amazon, KU, and Audible! Come tag along with Dan and best boy Croc as they take on the Eldritch horrors of the Backrooms and try to stay one step ahead of the Flayed Monarch!"
1j8s33h,https://www.reddit.com/r/ProgressionFantasy/comments/1j8s33h/overpowered_wizard_2_is_out_and_were_threatening/,1,2025-03-11T14:30:45+00:00,"Overpowered Wizard 2 is out, and we're threatening the System, the Universe, and Beyond with this one."
